{
  "company": {
    "name_en": "Osoul Elaf Operation and Maintenance Company",
    "name_ar": "شركة أصول إيلاف للتشغيل و الصيانة",
    "legal_form": "One Person Limited Liability Company",
    "registration_number": null
  },
  "fiscal_periods": [
    {
      "fiscal_year": 2025,
      "period_type": "ANNUAL",
      "period_number": 1,
      "end_date": "2025-12-31",
      "is_comparative": false
    },
    {
      "fiscal_year": 2024,
      "period_type": "ANNUAL",
      "period_number": 1,
      "end_date": "2024-12-31",
      "is_comparative": true
    }
  ],
  "currency": {
    "code": "SAR",
    "symbol": "ر.س",
    "name_en": "Saudi Riyal",
    "name_ar": "ريال سعودي"
  },
  "value_scale": {
    "multiplier": 1,
    "description_en": "Units",
    "description_ar": "وحدات"
  },
  "audit": {
    "is_audited": true,
    "auditor_name": "Saudi Group for Accounting and Auditing",
    "opinion_type": null,
    "audit_date": null
  },
  "document_info": {
    "title_en": "Annual Financial Statements",
    "title_ar": "القوائم المالية السنوية",
    "detected_language": "ar"
  },
  "confidence": {
    "overall": 0.92,
    "company_name": 0.98,
    "fiscal_year": 0.95,
    "currency": 0.95,
    "audit_info": 0.8
  }
}