{
  "company": {
    "name_en": "Al-Mabani Al-Asriya for Building Materials",
    "name_ar": "شركة المباني العصرية لمواد البناء",
    "legal_form": "LLC",
    "registration_number": null
  },
  "fiscal_periods": [
    {
      "fiscal_year": 2025,
      "period_type": "ANNUAL",
      "period_number": 1,
      "end_date": "2025-12-31",
      "is_comparative": false
    },
    {
      "fiscal_year": 2024,
      "period_type": "ANNUAL",
      "period_number": 1,
      "end_date": "2024-12-31",
      "is_comparative": true
    }
  ],
  "currency": {
    "code": "SAR",
    "symbol": "ر.س",
    "name_en": "Saudi Riyal",
    "name_ar": "ريال سعودي"
  },
  "value_scale": {
    "multiplier": 1,
    "description_en": "Actual units",
    "description_ar": "وحدات فعلية"
  },
  "audit": {
    "is_audited": false,
    "auditor_name": null,
    "opinion_type": null,
    "audit_date": null
  },
  "document_info": {
    "title_en": "Financial Statements",
    "title_ar": "القوائم المالية",
    "detected_language": "ar"
  },
  "confidence": {
    "overall": 0.9,
    "company_name": 0.98,
    "fiscal_year": 0.95,
    "currency": 0.95,
    "audit_info": 0.9
  }
}